Relavance,Content
related,In a cosmic twist of fate Boeing's Starliner has decided to extend its stay at the International Space Station with astronauts Suni Williams and Butch Wilmore as its unwilling passengers. The crippled spacecraft now affectionately known as 'The Hitchhiker' seems to prefer the… https://t.co/4zRixII5YM
unrelated,In a bizarre turn of events Northrop Grumman's Cygnus spacecraft clearly inspired by the slow and steady tortoise decided to take a leisurely stroll towards the International Space Station (ISS) after launching from Cape Canaveral. Following its decision to miss crucial… https://t.co/d7LahxlCwO
unrelated,NASA shared this video showing carbon dioxide emissions moving through earth's atmosphere. The video was created by Supercomputers using insane amounts of Data from satellites. https://t.co/U5KnbdRoIM
related,Hey @elonmusk   When is NASA going to let you go up to the space station and save their Astronauts?
unrelated,NASA’s Northrop Grumman Cygnus Continues to Space Station – Commercial Resupply https://t.co/U3dhypDmRi
unrelated,B-1B Tests New Pylon That Could Drastically Increase Its Weapons Carriage Capabilities  Boeing's Load Adaptable Modular pylon or LAM has the ability to greatly expand the B-1B's flexibility and kinetic punch.  Story: https://t.co/GTU4oRQILd
unrelated,Today We Found Out the NASA secret making it possible to upgrade your life and finances by tapping into hidden mental abilities. Do you think it would work for you? https://t.co/ncYGvymMuG https://t.co/4ydbXSY2sv
unrelated,B-1B Tests New Pylon That Could Drastically Increase Its Weapons Carriage Capabilities  Boeing's Load Adaptable Modular pylon or LAM has the ability to greatly expand the B-1B's flexibility and kinetic punch.  Story: https://t.co/xDOcM5RYon
unrelated,Test of Boeing's Nuclear Cruise Missile  The U.S. Air Force Global Strike Command has 528 AGM-86B nuclear cruise missiles.   These missiles have a range of over 2400 kilometers and are armed with the W80-1 nuclear warhead. The 130-kilogram warhead has an explosive yield… https://t.co/BPaeNZcezo https://t.co/3pcoz28EjX
unrelated,Northrop Grumman’s #Cygnus #spacecraft is about to dock with the #InternationalSpaceStation on its 21st resupply mission. https://t.co/Bb0VV0FwfH
unrelated,Maybe the same question wouldn't come up every time if there was an answer... It's at the point where Boeing would have had a public relations win if they had just sent the ship back empty weeks ago.    Now it's ingrained in everyone's mind daily.   Over and over and over. https://t.co/zWk7IDOPYe https://t.co/s1nB5GJWHn https://t.co/90kJGj74nA
related,IN THEORY: If the decision was made to undock Starliner without Crew they would need to send another Dragon to get them. In the meantime since all ports are occupied they can move their seats under Crew-8 Dragon Endeavour until another spacecraft can get them (1/6)
unrelated,She would be exposed this time. Back then she did all that under the pretense of good bahu. But this time she's become a complete vamp without mask.  She herself admitting that she's ready to break family house relationships to get back AR. So iss baar WW nhi hogi #yrkkh https://t.co/8DsAfUo4iG
unrelated,A new $115 million U.S. Army contract with Boeing adds two more Chinook Helicopters to Ridley's production line for 46 total. https://t.co/QexAwIqBsp
unrelated,SpaceX's Starship Could Cause NASA's Lunar Gateway to Lose Control https://t.co/VXtUWOPx95
unrelated,Mark Kelly has served his country as a U.S. Navy combat pilot a NASA astronaut and now as a U.S. Senator for Arizona. He is an independent leader who came to the Senate to serve Arizona’s working families not corporate special interests.  As the son of two police officers… https://t.co/jdQMUotZtZ
unrelated,NASA has a long way to go for mapping Our Galaxy; estimates as the Milky Way is made up of about 100 billion stars. https://t.co/NenJBFDwOC
unrelated,👀Most Watched by Yahoo Finance Users:  $AMD | Advanced Micro Devices  $BABA | Alibaba Group $PG | Procter &amp; Gamble  $GE | GE Aerospace $WMT | Walmart  $HD | Home Depot  $BA | Boeing  $JNJ | Johnson &amp; Johnson $KO | Coca-Cola  $XOM | Exxon Mobil $DIS | Walt Disney   #stockstowatch
related,"The news report flashed across his phone screen as Elon stepped out of the Tesla factory: “Boeing Starliner thrusters failing again. NASA considering SpaceX rescue options."" He scrubbed a hand over his tired face feeling the weight of a thousand decisions pressing down on him.… https://t.co/SfFb02Yxfh https://t.co/tLISTkw2mC"
unrelated,Mars—colonization—books and articles Source: NASA https://t.co/DKbMpIKw1r
unrelated,Anyone that works for Dell Intel Honeywell Amex Boeing or a basket of other trash companies is just begging to get laid off.  Literally like clockwork.  Not serious careers over there
unrelated,Hearing to probe Alaska Airlines emergency on Boeing jet https://t.co/QhdOKIYxbJ
unrelated,Amazing image of Pluto as captured by the New Horizons spacecraft. https://t.co/E3zqd8MIbG
unrelated,#aviationnews #Boeing @SpiritAero Executives to Testify at @NTSB Hearing on MAX 9 #Emergency Details: https://t.co/sVs1cAZw4u #aviationlovers #AvGeek #Avgeeks #Airlines #Airline #Boeing737 #Boeing777X #FLIGHT #flights #Airports #cabincrew #Aircraft #Pilot #pilots #Airbus #A350… https://t.co/cBForNzBNN
unrelated,https://t.co/LH5pTKtOLh  NASA strikes again. They have determined that a 410 foot asteroid will miss Earth by 7.5 million kilometers.  NASA can say whatever they want. Please don't tell me that you measured an asteroid from 7.5 million kilometers away. Just be honest and ask for… https://t.co/Uo7bgC6wEo
unrelated,Kinda hilarious that SpaceX flies a Boeing https://t.co/rFisujs1qW https://t.co/KsjxRs3H2n
related,"The Boeing Starliner situation is way more complicated than we previously thought.  @SciGuySpace points out in an Ars Technica article that ""three separate well-placed sources have confirmed to Ars that the current flight software on board Starliner cannot perform an automated… https://t.co/djFKNV2e2I https://t.co/26tXSbptEG"
related,"Remind me again....how much did we spend on ""Starliner""?"
unrelated,🌍 &amp; 🌕 taken by Cassini spacecraft NASA https://t.co/2KWummfq7E
unrelated,Key moments in Boeing’s difficult history with the 737 MAX https://t.co/BKjQP0tIJo
related,The Boeing Starliner spacecraft intended for transporting astronauts to and from the International Space Station (ISS) has encountered significant issues including the inability to autonomously undock and return to Earth due to incomplete flight software. This situation has… https://t.co/nkAKDNLNlL
unrelated,My good friend’s toy from Las Vegas in NASA Utah 6hr endurance race.  Looking forward to going sometime hopefully this year to one of his races. He is one of the most competitive guys I have ever met. Hint I love competition as well 😉 https://t.co/YU8haLyKQ1
unrelated,NASA's Laser Breakthrough: Interstellar Internet Takes Giant Leap  The news was brought to you by https://t.co/3UK4f97UVd. Listen version: https://t.co/evGVdxaxHQ  NASA has achieved a groundbreaking milestone in space communication technology. The agency successfully demonstrated… https://t.co/EVSTk1LiYa
unrelated,Last time he compared her with Sanjay n this time with Kaveri😒 I wish Abhira also compares him with Yuvraj in some instance tab samajh aayega iss ko  #AbhiraSharma #SamridhiiShukla #yrkkh https://t.co/jeJdBjzGWF
unrelated,According to NASA Cygnus arrival at ISS expected at 0710 UTC Aug 6.  Still no new TLE data from Space Force.
unrelated,TNA Wrestling makes its long-awaited return to San Antonio TX for back-to-back nights of high-energy pro wrestling on Sept 13-14 at the Boeing Center at Tech Port!  Get tickets and be there LIVE: https://t.co/hrFN63WC00 https://t.co/3mYjiBBZex
unrelated,We’ve welcomed sixteen trainee Aerospace Workers to our #P8 Poseidon program in South Australia. They’re the first of 40 new maintainers to join our team upgrading the @AusAirForce P-8A fleet to ensure they maintain best-for-mission capability.  More: https://t.co/X8TOjcfQlW https://t.co/FB9amGULSo
unrelated,BREAKING: Watch private Cygnus freighter arrive at the ISS early Aug. 6 - https://t.co/SV2SJzeaAe https://t.co/PWFjI7xRJF
unrelated,https://t.co/NIXOBewmra  After ISS: The private space station era is dawning
related,Boeing's Starliner *CANNOT* return home without crew https://t.co/yZXfNgSIZx via @YouTube
unrelated,Boeing Makes OUTRAGEOUS Plea Deal w/ Justice Dept! w/ Ian Carroll https://t.co/BhuVItux7r
unrelated,The plan to keep B-52s flying is getting even pricier | The Air Force has brought in a former Pentagon official to help negotiate with Boeing. https://t.co/7X91JXxoAD by @Audrey_decker9
unrelated,Jim Cramer says no to Delta Airlines and yes to Boeing!   https://t.co/AYOPQ6CTe5  #StockMarket #stockmarketcrash $BA $DAL
unrelated,NASA's new Astronauts https://t.co/6Ovwdp8UYL
unrelated,What's going on with @united and @Boeing ? Sao Paulo to DC was cancelled and the only way was to go to Newark. The return flight was cancelled again sent to Houston two days later Houston to Sao Paulo cancelled again postponed to the next day. Huge loss. Nothing to do with… https://t.co/TNnUSNWWHH https://t.co/f8fr12b15e
unrelated,Today We Found Out About the NASA secret study making it possible to upgrade your life and finances by tapping into hidden mental abilities. Do you think it would work for you? https://t.co/ncYGvymMuG https://t.co/vqGKJHgu15
related,NASA Might Delay Upcoming Crew 9 Mission to Return Stranded Starliner Astronauts to Earth https://t.co/T4oEu4UbCr
related,The Boeing Starliner spacecraft intended for transporting astronauts to and from the International Space Station (ISS) is facing significant issues with its flight software which cannot perform an automated undocking from the ISS and reentry into Earth's atmosphere. This… https://t.co/EizA1BmHMm
unrelated,For those buyers na nasa inyo na yung items kindly pay for the sf po :(( i dont have fixed rates for shipping cost since its a hassle for both of us to refund the excess sf that’s why i pay first before sending the tn &amp; sf. Next time i will have fixed rates na for sf if laging… https://t.co/WSo9hsqCl5
unrelated,for people in space like on the ISS is it always night for them or always day  how does time work in space https://t.co/WL5Hmx4Qma https://t.co/UOnVCK9cB4
related,#NASA faces a critical deadline to safely return astronauts #SunitaWilliams and #ButchWilmore from the International Space Station (ISS).  Read more 🔗 https://t.co/QqLIvJmzUZ https://t.co/lH4ER3VQ20
unrelated,Shield lost during Spacewalk outside ISS 📷 The object shown adrift in the video is a shield that was intended to be used to protect an unused port from space debris. Despite the loss other shields were successfully installed.  🛸 #ovnis #flyingsaucers #flyingsaucer #aliens https://t.co/XuPybt5VMj
unrelated,Hearing to probe Alaska Airlines emergency on Boeing jet https://t.co/CUlRwuE8Uj https://t.co/a0vmEsbCs2
related,- Wake up - Go to work - Leave work - Starliner in the news - Sleep (Repeat)
unrelated,#aviationnews #Defense #Poland Advances #Apache #helicopter Deal with #Boeing and GE Aerospace Offset Agreements. Details: https://t.co/Eqh9bO7UJB #aviationlovers #AvGeek #Avgeeks #Airlines #Airline #Boeing737 #Boeing777X #FLIGHT #flights #Airports #cabincrew #Aircraft #Pilot… https://t.co/3OCYBj8hLb
related,Please tell me that Starliner isn't cold-welded to the ISS because Boeing used inferior metals sourced from the lowest bidder.  (This is 100% my speculation—a thought that 'just popped into my head'—like a download.)  Can the astronauts spacewalk to the rescue Dragon if… https://t.co/rtnQmsgXtp https://t.co/OxjzrPCbBk https://t.co/EERixsYFzG
unrelated,Sun in ultraviolet and yes that's Venus passing in front of our sun! Credit - Nasa Solar Dynamics Observatory https://t.co/sWZQIFISp8
related,Yah this definitely complicates things for Boeing's Starliner! ☹️  How much anxiety do you think Butch &amp; Suni are feeling about hopping into Starliner &amp; disconnecting from the ISS? 🤔 https://t.co/ls8MuJn7D1
unrelated,It's understandable. He's standing in the perspective of a tech guy.  He wants something like we found the second earth.  As a tech guy but he can't create those things and starts blaming finance geeks like us??  Nasa blames Douyin (Tiktok) for their weakness? https://t.co/VaVxlXPbbR
unrelated,A Tiny Particle Smaller Than A Grain Of Sand Struck A Spacecraft At High Speed And Left A Hole In Its Protective Cover https://t.co/YPmEt1GQCT
related,I can't believe there are two astronauts stranded on the international space station and it's barely in the top ten of crazy shit in 2024!
unrelated,Alrighty y’all I’m off to Brazil for a quick minute. Wish me luck on these Boeing planes. ✈️ never know these days lol.
unrelated,BoEIng iS jUsT pErfOrmINng eXtRa TEstS wHiLe tHeY cAN.
related,NASA likely to significantly delay the launch of Crew 9 due to Starliner issues  NASA plans to delay the Crew-9 mission to the ISS from August 18 to September 24 due to concerns about the Starliner spacecraft. The mission originally set to carry four astronauts may be reduced… https://t.co/Hwto8vL8Z1 https://t.co/RWMNgMDMRq
related,Stop using that Boeing Starliner junk https://t.co/GNlHCHC98G
unrelated,Could the Perseid meteor shower threaten satellites and astronauts on the International Space Station?  https://t.co/FZzoWGDMkg
unrelated,Terrifying #asteroid coming towards Earth! Is there a reason to worry? Yes there is!  https://t.co/0qQYtE38f7
unrelated,Has Boeing been intentionally manipulating the companies reputation at the sacrifice of hundreds of people if not more to lower their stock price for a potential planned war in the future where politicians and large corporations can profit off of their involvement in… https://t.co/JW2V3yye7K
unrelated,The Langley Aerodrome # 8 is an electric-powered #drone that is used for research and testing. Data gathered from the Langley Aerodrome # 8 helps further research into air travel tech of the #future like package delivery drones and air taxis!  Video Credit: @nasa_langley  #nasa https://t.co/J0jzhhxry3
unrelated,Axiom Mission 4 to ISS will include India Poland Hungary  https://t.co/c27a1hO88p https://t.co/u7Y49R6VZq
related,In other News two Astronauts remain stranded in space as the Boeing Starliner officially becomes the new SS Minnow.  https://t.co/k3gC16BCKT
unrelated,"Night hike Downey California.  For any Blade Runner movie fans Downey is apparently where the character ""Officer K"" (Ryan Gosling) lived in ""Blade Runner 2049.""  Parts of the Apollo spaceships that took astronauts to the Moon were designed and made in Downey. https://t.co/j60VVd30ng"
unrelated,"Night hike Downey California.  For any Blade Runner movie fans Downey is apparently where the character ""Officer K"" (Ryan Gosling) lived in ""Blade Runner 2049.""  Parts of the Apollo spaceships that took astronauts to the Moon were designed and made in Downey. https://t.co/adK13ygIy7"
unrelated,Extremely close view of Jupiter's clouds... NASA https://t.co/11EsISxHeW
unrelated,Fantastic use of government money. https://t.co/TJQUXgJgst https://t.co/mMrM4lHB4M
related,The life of two Boeing Starliner astronauts stuck indefinitely in space - The Washington Post https://t.co/Qa0Z73gyQo
unrelated,I still do like these astronauts for the logo. I may rotate them out. It’s fun. Coffee’s good so why not? https://t.co/4kyUC3goZ9
unrelated,I think the Enterprise model cost more! Oh NO Not really! How much does NASA spend a day!? THE ONLY BULLSHIT ARTISTS THAT GET MORE IS UKRAINE!!!! WTF!!! https://t.co/8RqMY8ArGM
related,Isn’t @VP Kamala Harris the lead for @NASA and why has no one asked Kamala why the @BoeingSpace #Starliner which has failed and cannot bring astronauts (who have been stuck on #ISS for now 60 days) back home. Americans Sonny and Butch are stuck in space. @catturd2 @SaraCarterDC… https://t.co/zvTZQrefQd
related,Isn’t @VP Kamala Harris the lead for @NASA and why has no one asked Kamala why the @BoeingSpace #Starliner which has failed and cannot bring astronauts (who have been stuck on #ISS for 60 days) back home. Americans Sonny and Butch are stuck in space. @catturd2 @SaraCarterDC… https://t.co/4usCGfnYpe
related,Head of Boeing #Starliner https://t.co/tfYnOQMJ2O
unrelated,Today We Found Out the NASA secret that can boost your life and financial health by accessing your mind’s hidden abilities. Do you think it would work for you? https://t.co/ncYGvymMuG https://t.co/HNzwBKGS3t
unrelated,took a day and a half off work (+ weekend) to touch grass with my wife and kids  - Seguin to visit fam - San Antonio Riverwalk/Alamo - Austin for the inner space caverns  - Houston for NASA space center  refreshed and ready to get back to it   been an absolute grind since launch https://t.co/WDy0BnHGYK
unrelated,Matic nasa Platform voucher po ang ₱200 off. No need to claim  Cart na and check out later!  men’s jacket: https://t.co/77RCoeEocN michaela shoes: https://t.co/lLuYrlpRoQ figlia sandals: https://t.co/yKkGVjWOXr criza sandals: https://t.co/yiDTt51JHn sports shorts:… https://t.co/9wi29jzBYZ https://t.co/y0WzBBpUmp
related,Obviously I want @BoeingSpace #Starliner to succeed as a safe operational vehicle for #NASA access to LEO but clearly its time to cut losses on this particular mission. Bring the astronauts home on a @SpaceX #Dragon and if possible send Starliner home uncrewed and don't fly… https://t.co/bV67SB1ZUU https://t.co/xlelHuSTXJ
unrelated,Flight from Oklahoma City  https://t.co/j4QP5Z6n4r🚨🇺🇸USAF Boeing E3 Sentry alert looping over Kansas after departing from Oklahoma hours ago Being fed by air from a KC 135 Pegasus🇺🇸⚠️⚡️🚨 https://t.co/eC5PINjITk
unrelated,Space 101 for NASA: never ditch SpaceX ! https://t.co/9avnngK42w
related,"The joke used to be; ""built by the lowest bidder."" now the hard in your face truth is: ""developed and built by DEI""  NASA May Be Forced to Send Boeing's Busted Spacecraft Back Empty https://t.co/BRCXja6bmg"
related,Boeing's Starliner *CANNOT* return home without crew https://t.co/qlx3pnOpps via @YouTube
related,From @wired: @NASA Is ‘Evaluating All Options’ to Get the @BoeingSpace #Starliner Crew Home  https://t.co/XcavbcrVLx  #spacenews #perthnews #wanews #communitynews #astronomynews #astronomy #space #NASA https://t.co/0pQz7Cur3a
unrelated,Gorgeous: Storm clouds pictured from the International Space Station as it orbited 261 miles above Australia's Gulf of Carpentaria.  (Credit: NASA Johnson) https://t.co/WRIfDhdp1b
unrelated,One of the best image of Space ever taken The Sombrero Galaxy Infrared Credit:  NASA ESA Hubble https://t.co/OaXMZ9xLtF
unrelated,https://t.co/Gsq2lnW30a  @NASA  answer my tweeter traitors https://t.co/Dnorf9SsiN
related,OMG.  Boeing really screwed up multiple issues on this single spacecraft. https://t.co/ztoWlPSqJe
unrelated,Calling all college students! 📢   Student teams are invited to design cutting-edge aviation systems aimed at transforming agriculture by 2035 in NASA’s 2025 Gateways to Blue Skies Competition.  Join today! ✈️ https://t.co/e7lnzID5II https://t.co/tIwDaDAL7g
unrelated,The human race is in trouble. After narrowly claiming victory in the first invasion an assault by advanced militaristic aliens armed with light speed capable spacecraft is a continuing threat. https://t.co/nQCaihFPz9 #scifi @SamBMillerII
unrelated,An active volcano on IO (a moon of Jupiter) captured by NASA's Galileo spacecraft! (Credit: NASA/JPL) https://t.co/cZyNBlOSi6
related,Indian-origin astronaut Sunita Williams stranded in space for over 50 days may be at risk of potential vision problems https://t.co/LQuNKLXm1t https://t.co/PrHFvv0r60
unrelated,Boeing company team arrives in Pakistan. Private company is interested in acquiring Pakistan International Airlines (PIA) have sought detailed information on the airline’s daily flight operations.  https://t.co/Oh4Kz4b5TZ
unrelated,NASA announced a study on Unidentified Aerial Phenomena leading to the establishment of the Galileo Project by Avi Loeb aligning both initiatives in their approach to scientifically understand and collect data on UAP reflecting a growing openness among scientists towards s …
unrelated,Remember those field trips to the Carnegie Science Center or go even further back to the Buehl Planetarium. No trip was complete without a bag of this Freeze Dried Neapolitan Ice Cream that we were told Astronauts gladly eat in Space. Since I was a little girl I've been… https://t.co/1pjFQHZgok
unrelated,Alaska pilot describes ‘chaos’ as Boeing officials quizzed on mid-flight blowout https://t.co/RgHCjB6VYy
unrelated,Soak up the last of the summer skywatching season! This month keep an eye out for Mars and Jupiter's meet-up the Perseid meteors and a full Moon on Aug. 19. Watch for more @NASA stargazing tips and to learn how to observe the Lagoon Nebula. https://t.co/Q7vzuViV5Q https://t.co/a3kPVhtKna
unrelated,NASA Moon Space Challenger “Explosion” Psyop EXPOSED! Plus Trump and Adin Ross and More https://t.co/60UTvowHXe
unrelated,NASA Moon Space Challenger “Explosion” Psyop EXPOSED! Plus Trump and Adin Ross and More https://t.co/2GQHcAzIVM
unrelated,A National Transportation Safety Board hearing is making new information public about why a door panel wasn’t properly installed.  https://t.co/kEpvQhAVYq
unrelated,Extremely close view of Jupiter's clouds... NASA https://t.co/e5t9m9jwkL
unrelated,They are working on some design changes that will allow the door plug to not be closed if there's any issue until it's firmly secured. https://t.co/w07s32Lp9f
related,“Starliner’s Tribulation Contributing to Boeing’s Headaches”“Starliner’s Tribulation Contributing to Boeing’s Headaches” https://t.co/ffMzXNZSJE #NASA #Starliner #Boeing #SpaceX #ISS #InternationalSpaceStation #Space #Orbit #CrewDragon #EarthOrbit #SunitaWilliams #ButchWilmore… https://t.co/6TgyWpFPs3 https://t.co/jh7FVNuvIs
unrelated,Astronautshttps://t.co/dzZ6ujpqjj
related,This happens when nobody loses their job unless they mis gender someone.  Shock Revelation: Starliner Can't Undock From Space Station SafelyShock Revelation: Starliner Can't Undock From Space Station Safely https://t.co/5WqfmUvIYh
unrelated,Today We Found Out the NASA Breakthrough Study making it possible to enhance life and money situations by using the mind’s hidden potential. Do you think it would work for you? https://t.co/ncYGvymMuG https://t.co/lCwZR1oxjc
unrelated,📖 On this day August 6 2012 NASA's robotic vehicle Curiosity (also called Mars Science Laboratory) landed on Mars and soon began transmitting images of the planet's surface.
related,Boeing’s Starliner problems delay next Nasa astronaut mission #FMTNews #FMTWorld  https://t.co/q0OIQQhdE0
unrelated,🛑 #TechNewsThread   In a groundbreaking achievement #NASA has successfully transmitted a laser message from a #spacecraft located 10 million miles away from #Earth. This remarkable feat was accomplished using the agency's Deep Space Optical Communications (#DSOC) project which… https://t.co/Rc12wG6vpO https://t.co/eHWnQpZjqZ
related,#DEIhires Shock Revelation: Starliner Can't Undock From Space Station SafelyShock Revelation: Starliner Can't Undock From Space Station Safely https://t.co/QK9glncal7
unrelated,A Hawaii telescope captured an image of a glowing #nebula the remains of a star that collapsed in a #supernova explosion.   Does it remind you of an eery other worldly butterfly? Lit up by its core?  The #universe astounds me.  #astronomy #science #spacetelescope #NASA #Hubble https://t.co/flreZN374e
related,Boeing’s Starliner problems delay next Nasa astronaut mission #FMTNews #FMTWorld   https://t.co/q0OIQQhdE0
related,Boeing’s Starliner problems delay next Nasa astronaut mission #FMTNews #FMTWorld    https://t.co/q0OIQQhdE0
unrelated,NASA shared this video showing carbon dioxide emissions moving through earth's atmosphere. The video was created by Supercomputers using insane amounts of Data from satellites. https://t.co/GcOk7tHtPT
unrelated,Boeing Spirit AeroSystems tout safety moves since in-air panel blowout https://t.co/beY3gttpNE
unrelated,Personally I’d rather have a tech nerd on NASA team make the call. 🤷‍♀️ https://t.co/Vur6sDoWNW
undefined,Som ET - 59 - Mars - Perseverance Sol 662 - Video 2  This image was acquired on Dec. 30 2022 (Sol 662).  NASA Image: https://t.co/z5MALqu8KN  Audio: Som ET - 59 - Mars   Credit: NASA/JPL-Caltech/ASU https://t.co/eWmRfgdQy2
unrelated,nasa copywriter vsl: '' yes im good '' https://t.co/mHPEID5La8
related,“Starliner’s Tribulation Contributing to Boeing’s Headaches” - Audio Sample“Starliner’s Tribulation Contributing to Boeing’s Headaches” - Audio Sample https://t.co/r0Wx0DpsuN #NASA #Starliner #Boeing #SpaceX #ISS #InternationalSpaceStation #Space #Orbit #CrewDragon #EarthOrbit… https://t.co/VGqFXfm6oq https://t.co/oyUSosZO48
unrelated,NASA Moon Space Challenger “Explosion” Psyop EXPOSED by Florida resident! 😯  Plus Trump and Adin Ross and More  WATCH now and Chat with us live on Rumble!👇 https://t.co/laIUsSRerK
related,“Starliner’s Tribulation Contributing to Boeing’s Headaches” - Audio Sample“Starliner’s Tribulation Contributing to Boeing’s Headaches” - Audio Sample https://t.co/gPSiopTHDI via @YouTubeYouTube #NASA #Starliner #Boeing #SpaceX #ISS #InternationalSpaceStation #Space #Orbit… https://t.co/R9my63oUD1
